Mission name,Value,Organisation,Nation,Type (U/mass),Launch date,Status,Mission description,Link,Link_full,
"Gossamer (GOSSAMER-PICARD, GOSSAMER PICCOLOMINI)",蛛丝1号,Lunasonde,UK,1U,1/13/22,No signal,"Developing a platform for mapping resources up to 2 kilometers beneath the Earth’s surface, using novel low frequency radar technology.",sat/gossamer.html,https://www.nanosats.eu/sat/gossamer.html,
Hades,哈迪斯号,AMSAT-EA,Spain,PocketQube 1.5p,1/13/22,Semi-operational,Amateur communications implementing a Bend-Pipe type repeater and with Store & Forward capabilities.,sat/hades.html,https://www.nanosats.eu/sat/hades.html,
"HYPSO-1 (HYPer-spectral Satellite for ocean Observation, HYPSO-1)",高光谱海洋观测卫星1号,Norwegian University of Science and Technology (NTNU),US,6U,1/13/22,Operational,Hyperspectral imager to monitor algal blooms and other biological activity in the ocean.,sat/hypso.html,https://www.nanosats.eu/sat/hypso.html,
IRIS-A (Intelligent Remote-Sensing and Internet Satellite),智能遥感与互联网卫星A,National Cheng Kung University,Taiwan,2U,1/13/22,Operational,Test technology to improve the quality of downlink signals.,sat/iris-a.html,https://www.nanosats.eu/sat/iris-a.html,
"LabSat (LoCsat, Bio-nanosatellite)",实验室卫星,Wroclaw University of Science and Technology,Poland,3U,1/13/22,"Was semi-operational, ?","Researching the behavior of cancer cells and T lymphocytes, as well as the growth of fungi.",sat/labsat.html,https://www.nanosats.eu/sat/labsat.html,
"Lemur-2 148 Rohovithsa (Forest-1, FOREST, Forest Observation and Recognition Experimental Smallsat Thermal Detector))",狐猴卫星2-148,OroraTech,Germany,6U,1/13/22,Operational,Carry OroraTech’s first unique and proprietary thermal-infrared camera and data processing unit.,sat/lemur-2-rohovitsa.html,https://www.nanosats.eu/sat/lemur-2-rohovitsa.html,
Lemur-2 150 Djirang (NICSAT2),狐猴卫星2-150,Spire,US,6U,1/13/22,Operational,Capability of on-board computing and processing of machine learning and artificial intelligence across multi-modal data.,sat/lemur-2-djirang.html,https://www.nanosats.eu/sat/lemur-2-djirang.html,
"Lemur-2 151 Krywe (Adler-1, Austrian Debris Detection Low Earth orbit Reconnoiter, Lemur-2)",阿德勒1号,Austrian Space Forum (OeWF),Austria,3U,1/13/22,"Reentered, Operational",Study the (micro) space debris environment in LEO to complement the models by an active short-range radar as well as a deployable piezoelectric array.,sat/lemur-2-adler-1.html,https://www.nanosats.eu/sat/lemur-2-adler-1.html,
"MDASat-1a (ZACUBE-3, FireSat)",海洋领域感知卫星1a,Cape Peninsula University of Technology,South Africa,2U,1/13/22,Operational,Constellation for a ship-tracking payload (AIS) and imager for ocean color and fire tracking.,sat/mdasat-1.html,https://www.nanosats.eu/sat/mdasat-1.html,
"MDQubeSat-1 (MDQSAT-1, MDQube SAT1A, MDQUBE-SAT1, General San Martin)",MD立方星1号,Innova Space,Argentina,PocketQube 2p,1/13/22,No signal,Tech demo of Innova Space’s new pico-satellite constellation for IoT.,sat/mdqube-sata.html,https://www.nanosats.eu/sat/mdqube-sata.html,
NuX-1,努X1,NuSpace,Singapore,3U,1/13/22,No signal,IoT constellation demonstration.,sat/nux-1.html,https://www.nanosats.eu/sat/nux-1.html,
PAN A (Pathfinder for Autonomous Navigation),自主导航探路者A,Cornell University,US,3U,1/13/22,No signal,Technology demonstration to launch two 3U CubeSats that will autonomously rendezvous and dock in low-Earth orbit.,sat/pan.html,https://www.nanosats.eu/sat/pan.html,
PION-BR1,介子,PION Labs,Brazil,PocketQube 1p,1/13/22,No signal,Demonstrate PocketQube platform and attitude determination system.,sat/pion-br1.html,https://www.nanosats.eu/sat/pion-br1.html,
SanoSat-1 (Nepal PQ-1),尼泊尔口袋立方一号,ORION Space,Nepal,PocketQube 1p,1/13/22,Operational,Develop affordable picosatellite for the amateur radio community.,sat/nepali-pq-1.html,https://www.nanosats.eu/sat/nepali-pq-1.html,
SATLLA-2A (SATTLA-2A),萨特拉2A,Ariel University,Israel,PocketQube 2p,1/13/22,No signal,Educational amateur radio with LEDs and camera.,sat/satlla-2.html,https://www.nanosats.eu/sat/satlla-2.html,
"SteamSat-1 (SteamSat-2, SteamSat, SteamJet CubeSat)",蒸汽卫星2号,SteamJet,UK,1.5U,1/13/22,"Reentered, Unknown",Demonstrate a propulsion system.,sat/steamsat-1.html,https://www.nanosats.eu/sat/steamsat-1.html,
"SW1FT (Swift, SWIFTVISION)",“快速”卫星,SatRev,Poland,2U,1/13/22,Operational,In-orbit payload demonstration platform.,sat/sw1ft.html,https://www.nanosats.eu/sat/sw1ft.html,
"TartanArtibeus-1 (Orbital Edge Computing, Unicorn-2TA1, Tartan-Artibeus-1)",方格果蝠1号,Carnegie Mellon University,US,PocketQube 1p,1/13/22,No signal,Educational amateur radio mission with orbital edge computing elements.,sat/tartanartibeus-1.html,https://www.nanosats.eu/sat/tartanartibeus-1.html,
TechEdSat-13 (TES-13),科技教育卫星13号,NASA Ames Research Center,US,3U,1/13/22,Operational,Test several technologies intended to help better track and identify CubeSats.,sat/techedsat-13.html,https://www.nanosats.eu/sat/techedsat-13.html,
Tevel 1 (T1OFK),特维尔1号,Herzliya Science Center,Israel,1U,1/13/22,"Unknown, ?",Educational amateur radio mission with 8 identical CubeSats.,sat/tevel.html,https://www.nanosats.eu/sat/tevel.html,
Unicorn-1,独角兽1号,Alba Orbital,UK,PocketQube 2p,1/13/22,No signal,Demonstrate PocketQube technologies and trial a link to an Avanti geo-synchronous satellite called Artemis.,sat/unicorn-1.html,https://www.nanosats.eu/sat/unicorn-1.html,
Unicorn-2A,独角兽2A,Alba Orbital,UK,PocketQube 2p,1/13/22,No signal,Earth Observation constellation to provide near-real time satellite imagery.,sat/unicorn-2.html,https://www.nanosats.eu/sat/unicorn-2.html,
VZLUSAT-2,捷克航空航天研究中心卫星2号,University of West Bohemia,Czech,3U,1/13/22,Operational,Experimental Earth-observation camera and high-energy particle detectors.,sat/vzlusat-2.html,https://www.nanosats.eu/sat/vzlusat-2.html,
BAMA-1,巴马1号,University of Alabama,US,3U,2/10/22,Launch failure,Flight demonstration of a drag sail module by rapidly deorbiting the satellite.,sat/bama-1.html,https://www.nanosats.eu/sat/bama-1.html,
INCA (Ionospheric Neutron Content Analyzer),电离层中子含量分析者,New Mexico State University,US,3U,2/10/22,Launch failure,Study the latitude and time dependencies of the neutron spectrum to improve space weather models.,sat/inca.html,https://www.nanosats.eu/sat/inca.html,
QubeSat,“立方”星,"University of California, Berkeley",US,2U,2/10/22,Launch failure,Test and characterize the effects of space on quantum gyroscopes based on nitrogen-vacancy centers in diamond.,sat/qubesat.html,https://www.nanosats.eu/sat/qubesat.html,
R5-S1,R5 S1,NASA Johnson Space Center,US,3U,2/10/22,Launch failure,Demonstrate technologies to speed up hosted payload and in-space inspection.,sat/r5-s1.html,https://www.nanosats.eu/sat/r5-s1.html,
"INSPIRESat-1 (INternational Satellite Program In Research and Education Satellite, MinXSS-3)",启灵1号,Indian Institute of Space Science and Technology,India,8.6 kg,2/14/22,Operational,"Ionospheric measurements, establish educational program and constellation of space weather satellites.",sat/inspiresat-1.html,https://www.nanosats.eu/sat/inspiresat-1.html,
IHI-Sat,石川岛卫星,IHI Corporation,Japan,3U,2/19/22,"Reentered, Operational, ?",Demonstration of advanced AIS (Automatic Identification System) receiving system.,sat/ihi-sat.html,https://www.nanosats.eu/sat/ihi-sat.html,
KITSUNE (Kyutech standardized bus Imaging Technology System Utilizing Networking and Electron content measurements),狐妖号,Kyushu Institute of Technology,Japan,6U,2/19/22,"Reentered, Operational","Imaging mission, Kyutech Standardized Bus, IoT and Total electron content (TEC) measurement mission.",sat/kitsune.html,https://www.nanosats.eu/sat/kitsune.html,
"NACHOS (NanoSat Atmospheric Chemistry Hyperspectral Observation System, NACHOS-1)",纳星大气化学高光谱观测系统1号,Los Alamos National Laboratory (LANL),US,3U,2/19/22,"Reentered, Operational","Technology demonstration of an ultra-compact, high-resolution, hyperspectral imager.",sat/nachos.html,https://www.nanosats.eu/sat/nachos.html,
"Innovation Raytheon (Thor Smart Satellite, Chuangxing Leishen, Chuangxing Raytheon satellite, Yuanguang, Tiansuan constellation)",创星雷神号,Spacety,China,6U,2/27/22,Operational,Carry out the preliminary verification of the Tiansuan Constellation and the satellite-ground fusion service platform.,sat/innovation-raytheon.html,https://www.nanosats.eu/sat/innovation-raytheon.html,
"NOUR 02 (NOOR, Noor 2)",努尔2号,Iran's Islamic Revolutionary Guards Corps (IRGC),Iran,6U,3/8/22,Operational,Provides the Iranian elite force with the capability to monitor Earth from space.,sat/nour-2.html,https://www.nanosats.eu/sat/nour-2.html,
OreSat0,矿石卫星0号,Portland State University,US,1U,3/14/22,"Was operational, ?",Provide flight heritage to spacecraft bus and predecessor to the next satellite.,sat/oresat0.html,https://www.nanosats.eu/sat/oresat0.html,
Alfa Crux (AlfaCrux),阿尔法关键号,University of Brasilia,Brazil,1U,4/1/22,Operational,Research and experiments to be carried out in the communications field.,sat/alfa-crux.html,https://www.nanosats.eu/sat/alfa-crux.html,
"ARCSAT (ARCSAT-1, FFI CubeSat)",北极区域通信卫星,Norwegian Defence Research Establishment (FFI),Norway,6U,4/1/22,Operational,Demonstrate the use and relevance of a satellite relay for UHF communication at high latitudes.,sat/arcsat.html,https://www.nanosats.eu/sat/arcsat.html,
"BDSAT (BD SAT, CZE-BDSAT, BDSat-1)",BD卫星,Central European Institute of Technology (CEITEC),Czech,1U,4/1/22,Was operational,Amateur radio mission and test of pressure sensors and supercapacitor bank.,sat/bdsat.html,https://www.nanosats.eu/sat/bdsat.html,
"KSF2 A (Kleos Space – Polar Patrol Mission, Kleos-9, KSF2a, KSF2-A )",极地警戒任务,Kleos Space,UK,6U,4/1/22,Operational,Form the foundation of a constellation that delivers a global picture of hidden maritime activity.,sat/kleos-space.html,https://www.nanosats.eu/sat/kleos-space.html,
Pixxel-TD 2 (Shakuntala),皮克塞尔TD-2,Pixxel,India,6U,4/1/22,Operational,Capturing orbital images in more than 150 bands of color from the visible and infrared spectrum with a resolution of 10-meters per pixel,sat/td-2.html,https://www.nanosats.eu/sat/td-2.html,
PlantSat,植物卫星,University of Chile,Chile,3U,4/1/22,Operational,"Growing a plant in space simulating Mars conditions. Biological payloads, as well as other experiments with graphene-based devices",sat/plantsat.html,https://www.nanosats.eu/sat/plantsat.html,
"Spark-1 (Omnispace 1, OMNI-L1)",星火1号,Omnispace,US,12U,4/1/22,Operational,"Constellation for IoT using common cellular standards, but not focused on connecting cellphones to satellites.",sat/omnispace.html,https://www.nanosats.eu/sat/omnispace.html,
SUCHAI 2,智利大学航空航天研究2号,University of Chile,Chile,3U,4/1/22,Operational,Ionosphere and magnetosphere research. Optical payloads.,sat/suchai-2.html,https://www.nanosats.eu/sat/suchai-2.html,
SUCHAI 3,智利大学航空航天研究3号,University of Chile,Chile,3U,4/1/22,Operational,Ionosphere and magnetosphere research. Communication payloads.,sat/suchai-3.html,https://www.nanosats.eu/sat/suchai-3.html,
SUCHAI 3 Femtosatellite 1 (Subsatellite),智利大学航空航天研究3号,University of Chile,Chile,100 g,4/1/22,"On spacecraft, ?",Remotely estimate the geo-location of a femto-satellite using two CubeSats and the communication link.,sat/suchai-3-femtosatellite.html,https://www.nanosats.eu/sat/suchai-3-femtosatellite.html,
MyRadar-1 (MYRADAR1),“我的雷达”1号,ACME AtronOmatic (MyRadar),Germany,PocketQube 1p,5/2/22,Operational,Transmit SSTV images.,sat/myradar-1.html,https://www.nanosats.eu/sat/myradar-1.html,
"The Flying Object (AuroraSat-1, Aurora CubeSat)",极光卫星1号,Aurora Propulsion Technologies,Finland,1.5U,5/2/22,No signal,Demonstrate water resistojet thrusters and the Plasma Brake Module for deorbiting.,sat/aurorasat-1.html,https://www.nanosats.eu/sat/aurorasat-1.html,
TRSI-2,TRSI卫星2号,ACME AtronOmatic (MyRadar),Germany,PocketQube 1p,5/2/22,Operational,Transmit SSTV images.,sat/trsi-2.html,https://www.nanosats.eu/sat/trsi-2.html,
TRSI-3,TRSI卫星3号,ACME AtronOmatic (MyRadar),Germany,PocketQube 1p,5/2/22,Operational,Amateur satellite developed to test an experimental SSTV imaging downlink and amateur downlink beacon.,sat/trsi-3.html,https://www.nanosats.eu/sat/trsi-3.html,
"Zhixing-3A (, Zhixing-3 A, Zhixing No. 3 A Star)",智星三号A星,Smart Satellite,China,6U,5/9/22,"Reentered, Operational",Technology demonstration for the SAR constellation.,sat/zhixing-3a.html,https://www.nanosats.eu/sat/zhixing-3a.html,
AMS (Agile MicroSatellite),敏捷微卫星,MIT Lincoln Laboratory,US,6U,5/25/22,"Reentered, Operational",Demonstrate that a CubeSat can reliably operate in very low earth orbit.,sat/agile-microsatellite.html,https://www.nanosats.eu/sat/agile-microsatellite.html,
BroncoSat-1,烈马卫星1号,Cal Poly Pomona (Bronco Space),US,1.5U,5/25/22,No signal,Demonstrating NVIDIA Jetson Nano GPU as secondary flight computer.,sat/broncosat-1.html,https://www.nanosats.eu/sat/broncosat-1.html,
"CICERO-2 1 (VEH 1, Vehicle 1, Community Initiative for Continuous Earth Remote Observation, OP1, TYVAK-0820)",西塞罗2-1,GeoOptics,US,6U,5/25/22,Operational,Demonstration of GPS radio occultation sensor that allows the measurement of global weather pattern with high accuracy.,sat/cicero-2.html,https://www.nanosats.eu/sat/cicero-2.html,
"CNCE V4 (CNCE4, Cubesat Networked Communications Experiment, CNCE Block 2, HACSSAT-1)",立方星网络通信实验,Missile Defense Agency,US,3U,5/25/22,Operational,The cubesats will mimic two suborbital missile interceptor vehicles and test communications between them.,sat/cnce-block-2.html,https://www.nanosats.eu/sat/cnce-block-2.html,
Connecta T1.1,连接T1.1,Plan-S,Turkey,3U,5/25/22,Operational,Demo satellites for end-to-end solutions for global IoT services.,sat/connecta-t1.html,https://www.nanosats.eu/sat/connecta-t1.html,
"CPOD A (TYVAK-0032, FLT1, Cubesat Proximity Operations Demonstration, PONSFD-A, Proximity Operations Nano-Satellite Flight Demonstration, NASA CUBESAT PROXOPS)",立方星近距离操作演示A,Tyvak,US,3U,5/25/22,"Retired, Operational",Demonstrate proximity operations and docking between CubeSats.,sat/cpod.html,https://www.nanosats.eu/sat/cpod.html,
Foresail-1,前桅帆1号,Finnish Centre of Excellence for Sustainable Space,Finland,3U,5/25/22,Was operational,Particle detector to measure electrons and protons and Electrostatic Plasma Brake deorbiting experiment.,sat/foresail-1.html,https://www.nanosats.eu/sat/foresail-1.html,
"Guardian 1 (Aistech, ORB-6, Guardian1)",卫士号,Orbital Astronautics,UK,6U,5/25/22,"Unknown, ?",Hosted payload of Aistech multispectral telescope for a thermal data constellation.,sat/aistechsat-6u.html,https://www.nanosats.eu/sat/aistechsat-6u.html,
"Hatchling (Canary Hatchling, Veery FS-1, Orion, VEERY-FS1)",夜鸫FS-1,Care Weather,US,PocketQube 1p,5/25/22,No signal,"Early pathfinder mission for future cubesat constellation, which will map global oceanic vector winds on an hourly basis.",sat/hatchling.html,https://www.nanosats.eu/sat/hatchling.html,
Planetum-1 (Planetum 1),行星1号,Planetum (Prague Planetarium),Czech,1U,5/25/22,Operational,Launch a satellite into space designed to teach and popularize astronomy and cosmonautics.,sat/planetum-1.html,https://www.nanosats.eu/sat/planetum-1.html,
"Platform-1 (ENDURANCE, IBM, Shared Sat 2, SPARTAN-2, Shared Platform for Applied Research and Technology Affirmation, Shared Sat 3, SHAREDSAT 2141)",平台1号,EnduroSat,Bulgaria,6U,5/25/22,Operational,Technology demonstrations and commercial payloads.,sat/platform-1.html,https://www.nanosats.eu/sat/platform-1.html,
"PTD-3 TBIRD (PTD3, Tyvak-0125, PTHFDR, Pathfinder Technology Demonstrator, NASA PATHFINDER TD 3)",寻路技术演示器3号,NASA Ames Research Center,US,6U,5/25/22,Operational,Demonstrate a new laser communications system from MIT Lincoln Laboratory.,sat/ptd-3.html,https://www.nanosats.eu/sat/ptd-3.html,
SBUDNIC,小斯普特尼克号,Brown University,US,3U,5/25/22,"Reentered, No signal, Was semi-operational",Testing the limits of how quickly and efficiently a 3U CubeSat can be developed using parts that have never been to space before.,sat/sbudnic.html,https://www.nanosats.eu/sat/sbudnic.html,
SelfieSat,自拍卫星,Orbit NTNU,Norway,2U,5/25/22,Operational,Display a selfie and robotic arm with a camera will photograph the screen with the Earth in its background.,sat/selfiesat.html,https://www.nanosats.eu/sat/selfiesat.html,
SPiN-1 (MA61C),太空产品与创新1号,Space Products and Innovation,Germany,1U,5/25/22,No signal,"Demonstrate in-orbit reconfiguration and the benefits of modular satellite assembly with off-the-shelf components through MA61C, SPiN’s universal adapter.",sat/spin-1.html,https://www.nanosats.eu/sat/spin-1.html,
"Urdaneta (Urdaneta-Armsat-1, ARMSAT_1)",乌达内塔-臂卫星1号,SATLANTIS,Spain,16U,5/25/22,Operational,"The satellite is an iSIM-SAT 16U-CubeSat, equipped with an iSIM-90 camera onboard.",sat/urdaneta.html,https://www.nanosats.eu/sat/urdaneta.html,
VariSat-1 C (CELESTIS 21 - VARISAT 1C),多变卫星,VariSat (Omniteq),US,6U,5/25/22,"Operational, ?",Experiment and gain flight heritage with a satellite designed to support HF marine data communications.,sat/varisat-1.html,https://www.nanosats.eu/sat/varisat-1.html,
"Tsiolkovsky-Ryazan 1 (RS9S, Space-PI, Space π)",齐奥尔科夫斯基-梁赞1号,Southwestern State University,Russia,3U,6/3/22,"Reentered, Operational",Achieve autonomous grouping of satellites in space and measure density of vacuum.,sat/tsiolkovsky-ryazan.html,https://www.nanosats.eu/sat/tsiolkovsky-ryazan.html,
"MIMAN (Multi-spectral Imaging for Monitoring Aerosol by Nanosatellite, Monochrome Imaging for Monitoring Aerosol by Nanosatellite)",气溶胶单色监测成像纳卫星,Yonsei University,South Korea,3U,6/21/22,"Semi-operational, ?",Multi-spectral Imaging for Monitoring Aerosol by Nanosatellite.,sat/miman.html,https://www.nanosats.eu/sat/miman.html,
"RANDEV (Repeater Arrangement & Disaster Early View, ASTRIS 2, ASTRIS-II)",中继布置-初期灾难观测卫星,Korea Advanced Institute of Science and Technology (KAIST),South Korea,3U,6/21/22,Operational,"Earth observation mission to collect potential hazard image data from volcanoes, coasts, and clouds.",sat/randev.html,https://www.nanosats.eu/sat/randev.html,
Snuglite-II (Snuglite 2),首尔大学导航实验室卫星2号,Seoul National University,South Korea,3U,6/21/22,Was operational,Educational amateur radio mission with GPS receiver demonstration.,sat/snuglite-2.html,https://www.nanosats.eu/sat/snuglite-2.html,
STEP Cube Lab-II (STEP Cube Lab 2),空间技术实验项目-立方星实验室2号,Chosun University,South Korea,6U,6/21/22,"Was operational, ?",Earth observation misison with multi-band imager.,sat/step-2.html,https://www.nanosats.eu/sat/step-2.html,
CAPSTONE (Cislunar Autonomous Positioning System Technology Operations and Navigation Experiment),顶石号,NASA Ames Research Center,US,12U,6/28/22,Operational,Demonstrate spacecraft-to-spacecraft navigation and enter Lunar near-reactilinear halo orbit to verify its feasibility for the Gateway lunar orbiting outpost.,sat/capstone.html,https://www.nanosats.eu/sat/capstone.html,
"SCOOB-I (SCOOB 1, SCOOB-1, Student Satellite Series, S3-I))",史酷比1号,Nanyang Technological University,Singapore,3U,6/30/22,No signal,"Carries a solar spectral sensor, Earth imaging camera, Attitude Determination System and a novel solar panel",sat/scoob-i.html,https://www.nanosats.eu/sat/scoob-i.html,
"CTIM FD (Compact Total Irradiance Monitor Flight Demonstration, CTIM-FD)",小型全辐射照度监视器,University of Colorado Boulder,US,6U,7/2/22,"Reentered, Operational",Demonstrate next-generation Compact Total Irradiance Monitor that will help to provide an understanding of Earth’s climate change.,sat/ctim-fd.html,https://www.nanosats.eu/sat/ctim-fd.html,
GPX-2 (GPX2),全球定位新可能2号,NASA Langley Research Center,US,6U,7/2/22,Operational,Novel test-bed for Commercial Off-the-Shelf (COTS) differential global positioning systems (dGPS).,sat/gpx-2.html,https://www.nanosats.eu/sat/gpx-2.html,
Gunsmoke-L 1 (Lonestar),硝烟L1,US Army Space and Missile Defense Command,US,6U,7/2/22,"Reentered, Operational",Demonstrate an important test mission from LEO that will directly benefit the Army Warfighter in theater.,sat/gunsmoke-l.html,https://www.nanosats.eu/sat/gunsmoke-l.html,
"MISR-B (MISR-B-1, Modular Intelligence, Surveillance and Reconnaissance)",模块化情报监视侦察B,Space Systems Command,US,6U,7/2/22,"Reentered, Operational, ?","Demonstrate a robust, responsive, multi-mission CubeSat capability.",sat/misr-b.html,https://www.nanosats.eu/sat/misr-b.html,
Recurve,反曲弓号,Air Force Research Laboratory (AFRL),US,6U,7/2/22,Was operational,"Demonstrating adaptive radio frequency system capability from LEO, evaluating mesh network behavior across multiple nodes to route data wherever it needs to go.",sat/recurve.html,https://www.nanosats.eu/sat/recurve.html,
Slingshot-1,弹弓1号,Aerospace Corporation,US,12U,7/2/22,Operational,Advance on-orbit experiments using modular and autonomous technologies on next-generation satellite systems with SatCat5.,sat/slingshot-1.html,https://www.nanosats.eu/sat/slingshot-1.html,
ALPHA,阿尔法(意大利卫星),ARCA Dynamics,Italy,1U,7/13/22,No signal,MEO orbit to test CubeSat platform technologies in the highly radiative environment.,sat/alpha-arca.html,https://www.nanosats.eu/sat/alpha-arca.html,
"AstroBio Cubesat (ABCS, AstroBioCubeSat)",太空生物立方星,Sapienza University of Rome,Italy,3U,7/13/22,"Was operational, ?",MEO orbit and hosting a mini laboratory payload based on lab-on chip technology.,sat/astrobio-cubesat.html,https://www.nanosats.eu/sat/astrobio-cubesat.html,
"CELESTA (ROBUSTA 1D, CErn Latchup Experiment STudent sAtellite)",钢片琴,University of Montpellier,France,1U,7/13/22,Was operational,In-orbit testing of a radiation monitor and a single event latch-up experiment.,sat/celesta.html,https://www.nanosats.eu/sat/celesta.html,
"GreenCube (Italy-OSCAR 117, IO-117)",绿色植物立方卫星,Sapienza University of Rome,Italy,3U,7/13/22,Operational,Test an autonomous laboratory for the cultivation of microgreens on-board a CubeSat platform.,sat/greencube.html,https://www.nanosats.eu/sat/greencube.html,
TRISAT-R (TRISAT 2),“三”卫星-R,University of Maribor,Slovenia,3U,7/13/22,Operational,Investigate and map ionizing radiation in MEO orbits using several different instruments.,sat/trisat-r.html,https://www.nanosats.eu/sat/trisat-r.html,
BeaverCube,海狸立方星,MIT (Massachusetts Institute of Technology),US,3U,7/15/22,"Reentered, No signal",Educational mission to study cloud properties and shape memory alloy technologies.,sat/beavercube.html,https://www.nanosats.eu/sat/beavercube.html,
CapSat-1,帽子卫星1号,Weiss School,US,1U,7/15/22,"Reentered, Operational, ?",Educational mission and test the efficiency of using capacitors in place of batteries.,sat/capsat-1.html,https://www.nanosats.eu/sat/capsat-1.html,
"CLICK A (CubeSat Laser Infrared CrosslinK, CLICK-A)",激光红外交联立方星A星,MIT (Massachusetts Institute of Technology),US,3U,7/15/22,"Reentered, Operational",Technology demonstration mission for CLICK-B/C for laser downlink to Earth.,sat/click.html,https://www.nanosats.eu/sat/click.html,
D3 CubeSat (Drag De-Orbit Device CubeSat),拖动离轨装置,University of Florida,US,2U,7/15/22,"Reentered, Operational, ?","Demonstrate a simple, reliable, low-cost, non-propulsive system for deliberate deorbit.",sat/d3-cubesat.html,https://www.nanosats.eu/sat/d3-cubesat.html,
FUTABA,双叶号,Kyushu Institute of Technology,Japan,1U,7/15/22,"Reentered, Operational",Educational mission observing Pb-Free solders and amateur radio payload.,sat/futaba.html,https://www.nanosats.eu/sat/futaba.html,
HSU-SAT1 (Sekirei),幸福科学大学卫星1号,Happy Science University,Japan,1U,7/15/22,"Reentered, Operational",Educational mission to develop CubeSat platform technologies and amateur radio payload.,sat/hsu-sat1.html,https://www.nanosats.eu/sat/hsu-sat1.html,
JAGSAT (JAGSAT-1),等离子体电子密度测量卫星1号,University of South Alabama,US,2U,7/15/22,"Reentered, Was operational, ?",Keasure plasma electron density in the upper F layer of the ionosphere.,sat/jagsat.html,https://www.nanosats.eu/sat/jagsat.html,
TUMnanoSAT,摩尔多瓦技术大学微纳卫星,Technical University of Moldova,Moldova,1U,7/15/22,"Reentered, Was operational","Educational mission, capacity building and technology demonstration.",sat/tumnanosat.html,https://www.nanosats.eu/sat/tumnanosat.html,
AzaadiSAT,阿扎迪卫星,Space Kidz India,India,8 kg,8/7/22,Launch failure,Carries 75 different payloads each weighing around 50 grams and conducting femto-experiments. Girl students from rural regions across the country were provided guidance to build these payloads.,sat/azaadisat.html,https://www.nanosats.eu/sat/azaadisat.html,
"CUBESX-HSE-2 (HSE-2, RS21S, Space-PI 13, Space π)",高等经济大学立方星2号,Higher School of Economics,Russia,3U,8/9/22,Operational,"Monitoring of the Arctic, tests of the plasma engine.",sat/cubesx-hse-2.html,https://www.nanosats.eu/sat/cubesx-hse-2.html,
